標題,分類,作者,時間,連結,關鍵字
遭指控約炮　男歌手「直播剁手指」驚悚畫面曝光！,NOWnews>娛樂,記者吳雨婕綜合報導,2019-08-06 13:24:15,https://www.nownews.com/news/20190806/3544959/,PC ONE中國有嘻哈剁手紅花會貝貝醜聞
林采緹自爆想離婚　「遇到錯的人比單身還可怕」,NOWnews>其它,文姊妹淘希希,2019-08-06 12:19:10,https://www.nownews.com/news/20190806/3544780/,grace姊妹淘林采緹胡睿兒阿翔
Rain老婆準備生產　37歲二度當爸卻爆出「中年疾病」,NOWnews>娛樂,記者陳雅蘭台北報導,2019-08-06 12:07:10,https://www.nownews.com/news/20190806/3544683/,rain歡迎來到第2人生鄭智薰金泰希韓尚進
挺小英拚選？鄭弘儀傳重返政論戰場　電視台回應了,NOWnews>娛樂,娛樂中心／綜合報導,2019-08-06 11:55:31,https://www.nownews.com/news/20190806/3544535/,三立大話新聞政論節目鄭弘儀鄭知道了
車站巧遇「大咖女星」　王彩樺獲女神合影：像在作夢,NOWnews>娛樂,娛樂中心綜合報導,2019-08-06 11:16:12,https://www.nownews.com/news/20190806/3544396/,台灣濱崎步志玲姐姐林志玲王彩樺藝人巧遇
《普羅米亞》花7年完成！　新時代戰鬥動畫到來,NOWnews>娛樂>iLOOK電影,文iLOOK電影雜誌,2019-08-06 11:01:14,https://www.nownews.com/news/20190806/3536021/,普羅米亞電影
TWICE再爆戀愛「跟粉絲交往2年」　對象是SJ希澈,NOWnews>娛樂,記者陳雅蘭綜合報導,2019-08-06 10:27:50,https://www.nownews.com/news/20190806/3544420/,momosjtwicewanna one姜丹尼爾希澈志效
不要害怕做自己！　跟著《朵拉與失落的黃金城》踏上旅程,NOWnews>娛樂>iLOOK電影,文iLOOK電影雜誌,2019-08-06 10:08:34,https://www.nownews.com/news/20190806/3544387/,愛探險的朵拉朵拉朵拉與失落的黃金城電影
《大學生了沒》大亨持麻被逮！「檢驗報告出爐」首發聲,NOWnews>娛樂,娛樂中心／綜合報導,2019-08-06 09:57:01,https://www.nownews.com/news/20190806/3544278/,PokerStars名人涉毒埃華大亨大學生了沒
台視出現靈異事件　陳為民證實「這個攝影棚最陰」,NOWnews>娛樂,記者臺孝婷綜合報導,2019-08-06 08:57:08,https://www.nownews.com/news/20190806/3544281/,台視17Q成語蕎紀艾希陳為民靈異現象
殺人殺到「菜刀」滑出去　他血腥凌遲毛骨悚然,NOWnews>娛樂,記者翁新涵台北報導,2019-08-06 08:00:13,https://www.nownews.com/news/20190806/3543860/,宅男最乖巧的殺人犯波比達莊景燊黃河
被影射搞港獨　余文樂發聲明︰我是中國人！,NOWnews>娛樂,記者翁新涵綜合報導,2019-08-05 23:01:44,https://www.nownews.com/news/20190805/3544090/,余文樂春嬌與志明港獨王棠雲頭文字d
撇「要求月子中心全額贊助」　余苑綺自豪兒子帶財3百萬,NOWnews>娛樂,記者臺孝婷綜合報導,2019-08-05 22:30:14,https://www.nownews.com/news/20190805/3543618/,余天余苑綺星二代李亞萍藝人生產
不爽分手！　女星公開前男友「惡劣簡訊」被罵翻,NOWnews>娛樂,記者翁新涵綜合報導,2019-08-05 22:27:38,https://www.nownews.com/news/20190805/3544050/,HA:TFELTHappy Nowwonder girls珍雲譽恩
遭郭彥均無情幹譙　男星萌生退出演藝圈念頭,NOWnews>娛樂,記者臺孝婷綜合報導,2019-08-05 21:30:40,https://www.nownews.com/news/20190805/3543545/,李李仁竇智孔舞陽請問今晚住誰家郭彥均
直播／走過轉型低潮破繭而出　霹靂上架Netflix躍上國際,NOWnews>影音>今日英雄,財經中心／綜合報導,2019-08-05 21:00:39,https://www.nownews.com/news/20190805/3543598/,netflix今日英雄刀說異數接班霹靂布袋戲
今日英雄／霹靂兄妹接班一靜一動　異口同聲這題麥擱問！,NOWnews>影音>今日英雄,記者許家禎專題報導,2019-08-05 20:50:42,https://www.nownews.com/news/20190805/3541551/,布袋戲霹靂霹靂黃家黃亮勛黃政嘉
今日英雄／霹靂跨文化與時俱進　上架Netflix將破繭而出,NOWnews>影音>今日英雄,記者彭夢竺／專題報導,2019-08-05 20:45:09,https://www.nownews.com/news/20190805/3541699/,netflix刀說異數霹靂布袋戲黃亮勛黃政嘉
今日英雄／霹靂黃家百年壓力大　兄妹接班互虧紓壓,NOWnews>影音>今日英雄,記者許家禎專題報導,2019-08-05 20:40:50,https://www.nownews.com/news/20190805/3541592/,布袋戲接班霹靂黃亮勛黃強華黃政嘉
影／盛竹如重現《藍色蜘蛛網》　從無頭女屍案開始,NOWnews>娛樂,記者翁新涵台北報導,2019-08-05 19:56:07,https://www.nownews.com/news/20190805/3543798/,盛竹如緝魔莊凱勛藍色蜘蛛網邵雨薇
史蒂芬金親掛保證　《牠 第二章》像雲霄飛車般驚悚,NOWnews>娛樂>iLOOK電影,文iLOOK電影雜誌,2019-08-05 19:01:03,https://www.nownews.com/news/20190805/3543260/,史蒂芬金牠牠 第二章電影
蔡阿嘎員工旅遊照曝光！　粉絲一看全暴動：抓到大頭佛,NOWnews>娛樂,編輯中心綜合報導,2019-08-05 18:50:45,https://www.nownews.com/news/20190805/3543481/,合照員工旅遊大頭佛蔡阿嘎露臉
影／OOOPS！偶像上台褲子「拉鍊沒關」　全場尖叫,NOWnews>娛樂,記者翁新涵綜合報導,2019-08-05 18:24:13,https://www.nownews.com/news/20190805/3543431/,exosmtown伯賢允浩燦烈
蔡阿嘎員工旅遊照曝光！　粉絲一看全暴動：抓到大頭佛,NOWnews>娛樂,編輯中心綜合報導,2019-08-05 18:50:45,https://www.nownews.com/news/20190805/3543481/,合照員工旅遊大頭佛蔡阿嘎露臉
影／OOOPS！偶像上台褲子「拉鍊沒關」　全場尖叫,NOWnews>娛樂,記者翁新涵綜合報導,2019-08-05 18:24:13,https://www.nownews.com/news/20190805/3543431/,exosmtown伯賢允浩燦烈
被爆和金南佶11月完婚　張娜拉心情慘淡嘆「平白被捉弄」,NOWnews>娛樂,記者臺孝婷綜合報導,2019-08-05 18:00:09,https://www.nownews.com/news/20190805/3543379/,婚訊張娜拉緋聞金南佶韓星
影／網美趴地與愛犬合照　邪惡視角「超深事業線」全都錄,NOWnews>娛樂,編輯中心綜合報導,2019-08-05 17:54:29,https://www.nownews.com/news/20190805/3543189/,ig事業線國光幫幫忙狗狗芷涵
影／頂級和牛or超市肉差在哪？調包測味蕾　結局萬人笑歪,NOWnews>國際,編輯中心綜合報導,2019-08-05 17:49:05,https://www.nownews.com/news/20190805/3542925/,a5和牛youtuber人類觀察日本老高與小茉超市
今日娛樂爆／52歲張信哲崩壞？「地中海禿」大叔照瘋傳,NOWnews>娛樂,娛樂中心／綜合報導,2019-08-05 17:44:42,https://www.nownews.com/news/20190805/3543075/,UNHERO台北聖道兒童之家張信哲忠孝節義楊麗花田亞霍跳舞吧大象金瑞瑤
「鬼故事宇宙」即將誕生？！　金獎大導要你坐立難安,NOWnews>娛樂>iLOOK電影,文iLOOK電影雜誌,2019-08-05 17:03:10,https://www.nownews.com/news/20190805/3543172/,在黑暗中說的鬼故事電影
中華職棒／驚爆被排擠？　Yuri：現在真的沒有啦！,NOWnews>娛樂,記者劉祐廷台北報導,2019-08-05 16:44:01,https://www.nownews.com/news/20190805/3542993/,lamigirlslamigoYuri中華職棒統一獅
連二暴怒文疑譙王瞳！邱琦雯公開「劇組照」吐真實心聲　,NOWnews>娛樂,娛樂中心／綜合報導,2019-08-05 16:04:43,https://www.nownews.com/news/20190805/3542825/,大時代小三女星王瞳邱琦雯馬俊麟
姜丹尼爾豪宅幽會志效　宋慧喬在內「超狂鄰居名單」曝光,NOWnews>IAFB,記者臺孝婷綜合報導,2019-08-05 15:58:12,https://www.nownews.com/news/20190805/3542954/,twice姜丹尼爾志效明星情侶漢南洞
Lamigirls新EP火辣發行　神秘嘉賓小鐘現場猛撩妹,NOWnews>娛樂,記者劉祐廷台北報導,2019-08-05 15:55:40,https://www.nownews.com/news/20190805/3542845/,Dancing Holidayeplamigirlslamigo中華職棒
多圖／歐陽娜娜居然滿臉「長雀斑」 　狂迷哭哭,NOWnews>娛樂,記者翁新涵綜合報導,2019-08-05 15:20:17,https://www.nownews.com/news/20190805/3542885/,傅娟歐陽妮妮歐陽娜娜歐陽娣娣歐陽龍
